name,registry,related_pages,url,description,hide
The Data Use Ontology (DUO),fairsharing:5dnjs2,hbd_data_sources,https://raw.githubusercontent.com/EBISPOT/DUO/master/duo.owl,"The Data Use Ontology (DUO) describes data use requirements and limitations. DUO allows to semantically tag datasets with restriction about their usage, making them discoverable automatically based on the authorization level of users, or intended usage. This resource is based on the OBO Foundry principles, and developed using the W3C Web Ontology Language. It is used in production by the European Genome-phenome Archive (EGA) at EMBL-EBI and CRG as well as the Broad Institute for the Data Use Oversight System (DUOS).",
toil-cwl-runner,,hbd_data_analysis,https://toil.readthedocs.io/en/latest/running/cwl.html,"The toil-cwl-runner command provides cwl-parsing functionality using cwltool, and leverages the job-scheduling and batch system support of Toil.",
UCSC Genome Browser,biotools:ucsc_genome_browser,"covid19_galaxy_project, hbd_data_analysis",https://genome.ucsc.edu/,An online tool for analyzing and visualizing genomic data. It allows users to add and share annotations.,
VarScan,biotools:varscan,hbd_data_analysis,https://github.com/dkoboldt/varscan,Variant calling and somatic mutation/CNV detection for next-generation sequencing data,
VEP,biotools:vep,hbd_data_analysis,https://github.com/Ensembl/ensembl-vep,VEP (Variant Effect Predictor) predicts the functional effects of genomic variants.,
WorkflowHub,fairsharing:07cf72,covid19_galaxy_project,https://workflowhub.eu,"A registry for describing, sharing and publishing scientific computational workflows.",
wtdbg2,biotools:wtdbg2,hbd_data_analysis,https://github.com/ruanjue/wtdbg2,Wtdbg2 is a de novo sequence assembler for long noisy reads produced by PacBio or Oxford Nanopore Technologies (ONT).,
XCMS,biotools:xcms,hbd_data_analysis,https://xcmsonline.scripps.edu/landing_page.php?pgcontent=mainPage,Metabolomic and lipidomic platform,
Zenodo,fairsharing:wy4egf,hbd_data_sources,https://www.zenodo.org/,"Zenodo is a generalist research data repository built and developed by OpenAIRE and CERN. It was developed to aid Open Science and is built on open source code. Zenodo helps researchers receive credit by making the research results citable and through OpenAIRE integrates them into existing reporting lines to funding agencies like the European Commission. Citation information is also passed to DataCite and onto the scholarly aggregators. Content is available publicly under any one of 400 open licences (from opendefinition.org and spdx.org). Restricted and Closed content is also supported. Free for researchers below 50 GB/dataset. Content is both online on disk and offline on tape as part of a long-term preservation policy. Zenodo supports managed access (with an access request workflow) as well as embargoing generally and during peer review. The base infrastructure of Zenodo is provided by CERN, a non-profit IGO. Projects are funded through grants.",
FAIRsharing,fairsharing:2abjs5,hbd_data_sources,https://fairsharing.org/,"FAIRsharing is a FAIR-supporting resource that provides an informative and educational registry on data standards, databases, repositories and policy, alongside search and visualization tools and services that interoperate with other FAIR-enabling resources. FAIRsharing guides consumers to discover, select and use standards, databases, repositories and policy with confidence, and producers to make their resources more discoverable, more widely adopted and cited. Each record in FAIRsharing is curated in collaboration with the maintainers of the resource themselves, ensuring that the metadata in the FAIRsharing registry is accurate and timely. Every record is manually reviewed at least once a year. Records can be collated into collections, based on a project, society or organisation, or Recommendations, where they are collated around a policy, such as a journal or funder data policy.",
